Cites,Authors,Title,Year,Source,Publisher,ArticleURL,CitesURL,GSRank,QueryDate,Type,DOI,ISSN,CitationURL,Volume,Issue,StartPage,EndPage,ECC,CitesPerYear,CitesPerAuthor,AuthorCount,Age,Abstract,FullTextURL,RelatedURL
4,"A Tocchetti, L Corti, M Brambilla, DD Marco","A web-based co-creation and user engagement method and platform",2021,"International Conference on …","Springer","https://link.springer.com/chapter/10.1007/978-3-030-74296-6_38","https://scholar.google.com/scholar?cites=14874566994115621268&as_sdt=2005&sciodt=2007&hl=en",110,"2025-06-19 13:14:20","HTML","10.1007/978-3-030-74296-6_38","","",,,,,4,1.00,1,4,4,"In recent years, new methods to engage citizens in deliberative processes of governments and institutions have been studied. Such methodologies have become a necessity to assure …","https://link.springer.com/chapter/10.1007/978-3-030-74296-6_38","https://scholar.google.com/scholar?q=related:lPECUN8Tbc4J:scholar.google.com/&scioq=source:%22international+conference+on+web+engineering%22&hl=en&as_sdt=2007&as_ylo=2019&as_yhi=2024"
5,"H Maziad, JA Rammouz, BE Asmar, J Tekli","Preprocessing techniques for end-to-end trainable RNN-based conversational system",2021,"International Conference on …","Springer","https://link.springer.com/chapter/10.1007/978-3-030-74296-6_20","https://scholar.google.com/scholar?cites=6841117149007262807&as_sdt=2005&sciodt=2007&hl=en",117,"2025-06-19 13:14:20","","10.1007/978-3-030-74296-6_20","","",,,,,5,1.25,1,4,4,"Spoken dialogue system interfaces are gaining increasing attention, with examples including Apple's Siri, Amazon's Alexa, and numerous other products. Yet most existing …","https://soe.lau.edu.lb/files/tekli_Manuscript8-ICWE2021.pdf","https://scholar.google.com/scholar?q=related:VzRpHc2H8F4J:scholar.google.com/&scioq=source:%22international+conference+on+web+engineering%22&hl=en&as_sdt=2007&as_ylo=2019&as_yhi=2024"
5,"C González-Mora, I Garrigós, JN Mazón…","Open data accessibility based on voice commands",2021,"International Conference …","Springer","https://link.springer.com/chapter/10.1007/978-3-030-74296-6_34","https://scholar.google.com/scholar?cites=9945126086805997259&as_sdt=2005&sciodt=2007&hl=en",124,"2025-06-19 13:14:20","","10.1007/978-3-030-74296-6_34","","",,,,,5,1.25,1,4,4,"Nowadays, the accessibility of open data on the Web is problematic, in particular for those data enthusiasts (non-technical users really interested in data) with visual disabilities. They …","","https://scholar.google.com/scholar?q=related:y8aKAnwvBIoJ:scholar.google.com/&scioq=source:%22international+conference+on+web+engineering%22&hl=en&as_sdt=2007&as_ylo=2019&as_yhi=2024"
4,"E Korkan, F Salama, S Kaebisch…","A-MaGe: Atomic mashup generator for the web of things",2021,"International Conference …","Springer","https://link.springer.com/chapter/10.1007/978-3-030-74296-6_24","https://scholar.google.com/scholar?cites=16699606119764899245&as_sdt=2005&sciodt=2007&hl=en",127,"2025-06-19 13:14:20","","10.1007/978-3-030-74296-6_24","","",,,,,4,1.00,1,4,4,"Abstract Individually, Internet of Things (IoT) devices are often not able to achieve complex functionalities and, therefore, need to be composed together into useful mashups. However …","","https://scholar.google.com/scholar?q=related:rbWGoUnrwOcJ:scholar.google.com/&scioq=source:%22international+conference+on+web+engineering%22&hl=en&as_sdt=2007&as_ylo=2019&as_yhi=2024"
2,"S Heil, M Bakaev, M Gaedke","Web User Interface as a Message: Power Law for Fraud Detection in Crowdsourced Labeling",2021,"International Conference on Web …","Springer","https://link.springer.com/chapter/10.1007/978-3-030-74296-6_7","https://scholar.google.com/scholar?cites=8614603502823239056&as_sdt=2005&sciodt=2007&hl=en",131,"2025-06-19 13:14:20","","10.1007/978-3-030-74296-6_7","","",,,,,2,0.50,1,3,4,"Web Engineering becomes increasingly hungry for training data, as the application of machine learning (ML) methods in the field intensifies. Human-labeled datasets are …","https://www.academia.edu/download/84597668/Heil2021_Chapter_WebUserInterfaceAsAMessage_1_.pdf","https://scholar.google.com/scholar?q=related:kG2dYj44jXcJ:scholar.google.com/&scioq=source:%22international+conference+on+web+engineering%22&hl=en&as_sdt=2007&as_ylo=2019&as_yhi=2024"
3,"M Brambilla, D Molinelli","Voice-based virtual assistants for user interaction modeling",2021,"International Conference on Web Engineering","Springer","https://link.springer.com/chapter/10.1007/978-3-030-74296-6_45","https://scholar.google.com/scholar?cites=11751795107380638158&as_sdt=2005&sciodt=2007&hl=en",133,"2025-06-19 13:14:20","","10.1007/978-3-030-74296-6_45","","",,,,,3,0.75,2,2,4,"In this work, we propose a virtual assistant that allows building models by means of voice commands. To demonstrate the generality of the approach, we describe three alternative …","","https://scholar.google.com/scholar?q=related:zrGY8GLDFqMJ:scholar.google.com/&scioq=source:%22international+conference+on+web+engineering%22&hl=en&as_sdt=2007&as_ylo=2019&as_yhi=2024"
3,"Y Yang, H Wang, J Zhu, W Shi, W Guo…","Effective seed-guided topic labeling for dataless hierarchical short text classification",2021,"International Conference …","Springer","https://link.springer.com/chapter/10.1007/978-3-030-74296-6_21","https://scholar.google.com/scholar?cites=17168304355268597746&as_sdt=2005&sciodt=2007&hl=en",136,"2025-06-19 13:14:20","","10.1007/978-3-030-74296-6_21","","",,,,,3,0.75,1,6,4,"Hierarchical text classification has a wide application prospect on the Internet, which aims to classify texts into a given hierarchy. Supervised methods require a large amount of labeled …","https://www.researchgate.net/profile/Jiaqi-Zhu-29/publication/351487692_Effective_Seed-Guided_Topic_Labeling_for_Dataless_Hierarchical_Short_Text_Classification/links/630aea3f5eed5e4bd1250aad/Effective-Seed-Guided-Topic-Labeling-for-Dataless-Hierarchical-Short-Text-Classification.pdf","https://scholar.google.com/scholar?q=related:8peTe9kRQu4J:scholar.google.com/&scioq=source:%22international+conference+on+web+engineering%22&hl=en&as_sdt=2007&as_ylo=2019&as_yhi=2024"
4,"F Burzlaff, C Bartelt","Knowledge-driven architecture composition: Assisting the system integrator to reuse integration knowledge",2021,"International Conference on Web Engineering","Springer","https://link.springer.com/chapter/10.1007/978-3-030-74296-6_23","https://scholar.google.com/scholar?cites=3311859949463679152&as_sdt=2005&sciodt=2007&hl=en",148,"2025-06-19 13:14:20","","10.1007/978-3-030-74296-6_23","","",,,,,4,1.00,2,2,4,"Semantic interoperability for web services is still a problem. Although decentralized solutions such as describing the integration context with a formal mapping language or …","https://www.uni-mannheim.de/media/Einrichtungen/ines/Preprints/ICWE-online.pdf","https://scholar.google.com/scholar?q=related:sDCguRMX9i0J:scholar.google.com/&scioq=source:%22international+conference+on+web+engineering%22&hl=en&as_sdt=2007&as_ylo=2019&as_yhi=2024"
2,"B Bühler, H Paulheim","Web table classification based on visual features",2021,"International Conference on Web Engineering","Springer","https://link.springer.com/chapter/10.1007/978-3-030-74296-6_15","https://scholar.google.com/scholar?cites=5267850842733131077&as_sdt=2005&sciodt=2007&hl=en",152,"2025-06-19 13:14:20","","10.1007/978-3-030-74296-6_15","","",,,,,2,0.50,1,2,4,"Tables on the web constitute a valuable data source for many applications, like factual search and knowledge base augmentation. However, as genuine tables containing …","https://arxiv.org/pdf/2103.05110","https://scholar.google.com/scholar?q=related:RbXZYm4qG0kJ:scholar.google.com/&scioq=source:%22international+conference+on+web+engineering%22&hl=en&as_sdt=2007&as_ylo=2019&as_yhi=2024"
1,"P Rodwald","Effectiveness Comparison of Email Addresses Recovery from Gravatars",2021,"International Conference on Web Engineering","Springer","https://link.springer.com/chapter/10.1007/978-3-030-74296-6_39","https://scholar.google.com/scholar?cites=417474561167472503&as_sdt=2005&sciodt=2007&hl=en",165,"2025-06-19 13:14:20","","10.1007/978-3-030-74296-6_39","","",,,,,1,0.25,1,1,4,"Internet was not designed for anonymity, but most users posting comments with unidentifiable pseudonyms hope to stay anonymous. On many websites, especially those …","https://www.researchgate.net/profile/Przemyslaw-Rodwald/publication/351485959_Effectiveness_Comparison_of_Email_Addresses_Recovery_from_Gravatars/links/61cc0f90e669ee0f5c6fcb4b/Effectiveness-Comparison-of-Email-Addresses-Recovery-from-Gravatars.pdf","https://scholar.google.com/scholar?q=related:dzcmyeYqywUJ:scholar.google.com/&scioq=source:%22international+conference+on+web+engineering%22&hl=en&as_sdt=2007&as_ylo=2019&as_yhi=2024"
3,"M He, Z Huang, H Wen","MPIA: multiple preferences with item attributes for graph convolutional collaborative filtering",2021,"International Conference on Web Engineering","Springer","https://link.springer.com/chapter/10.1007/978-3-030-74296-6_18","https://scholar.google.com/scholar?cites=9698691186629790164&as_sdt=2005&sciodt=2007&hl=en",169,"2025-06-19 13:14:20","","10.1007/978-3-030-74296-6_18","","",,,,,3,0.75,1,3,4,"Personalized recommender systems are playing an increasingly critical role in a variety of online applications. In recent years, advancements in graph-structured deep neural …","","https://scholar.google.com/scholar?q=related:1MlHlT-smIYJ:scholar.google.com/&scioq=source:%22international+conference+on+web+engineering%22&hl=en&as_sdt=2007&as_ylo=2019&as_yhi=2024"
3,"L Li, Y Yang, S Zhan, B Wu","Sentence dependent-aware network for aspect-category sentiment analysis",2021,"International Conference on Web Engineering","Springer","https://link.springer.com/chapter/10.1007/978-3-030-74296-6_13","https://scholar.google.com/scholar?cites=15275626464377165825&as_sdt=2005&sciodt=2007&hl=en",170,"2025-06-19 13:14:20","","10.1007/978-3-030-74296-6_13","","",,,,,3,0.75,1,4,4,"Abstract The purpose of Aspect-Category Sentiment Analysis is to predict sentiment polarities of given aspect categories in sentences. Most previous methods used attention …","","https://scholar.google.com/scholar?q=related:AdjB6lXt_dMJ:scholar.google.com/&scioq=source:%22international+conference+on+web+engineering%22&hl=en&as_sdt=2007&as_ylo=2019&as_yhi=2024"
1,"JM Almendros-Jiménez, A Becerra-Terón","A Web Tool for XQuery Debugging",2021,"International Conference on …","Springer","https://link.springer.com/chapter/10.1007/978-3-030-74296-6_40","https://scholar.google.com/scholar?cites=11553883086246496378&as_sdt=2005&sciodt=2007&hl=en",177,"2025-06-19 13:14:20","","10.1007/978-3-030-74296-6_40","","",,,,,1,0.25,1,2,4,"This system demo shows how to debug XQuery programs using an algorithmic debugger developed for XQuery. The debugging process consists in the building of a debugging tree …","","https://scholar.google.com/scholar?q=related:esgdrHOjV6AJ:scholar.google.com/&scioq=source:%22international+conference+on+web+engineering%22&hl=en&as_sdt=2007&as_ylo=2019&as_yhi=2024"
3,"P Tengkiattrakul, S Maneeroj, A Takasu","Attentive hybrid collaborative filtering for rating conversion in recommender systems",2021,"International Conference on Web …","Springer","https://link.springer.com/chapter/10.1007/978-3-030-74296-6_12","https://scholar.google.com/scholar?cites=5856369872644612662&as_sdt=2005&sciodt=2007&hl=en",182,"2025-06-19 13:14:20","","10.1007/978-3-030-74296-6_12","","",,,,,3,0.75,1,3,4,"Recommendation models that use collaborative filtering consider the influence of friends and neighbors when recommending suitable items for a target user. Most of these …","","https://scholar.google.com/scholar?q=related:NiJI7F4BRlEJ:scholar.google.com/&scioq=source:%22international+conference+on+web+engineering%22&hl=en&as_sdt=2007&as_ylo=2019&as_yhi=2024"
1,"V Siegert, M Gaedke","Wta: Towards a web-based testbed architecture",2021,"International Conference on Web Engineering","Springer","https://link.springer.com/chapter/10.1007/978-3-030-74296-6_9","https://scholar.google.com/scholar?cites=11220343695010965523&as_sdt=2005&sciodt=2007&hl=en",187,"2025-06-19 13:14:20","","10.1007/978-3-030-74296-6_9","","",,,,,1,0.25,1,2,4,"Tests, evaluations, and solution comparisons in complex use cases are often realized by creating a testbed for a domain of use cases and solutions. Web-based testbeds add key …","https://vsr.informatik.tu-chemnitz.de/people/siegert/publications/WTA--Towards-a-Web-based-Testbed-Architecture.pdf","https://scholar.google.com/scholar?q=related:EyjshiSrtpsJ:scholar.google.com/&scioq=source:%22international+conference+on+web+engineering%22&hl=en&as_sdt=2007&as_ylo=2019&as_yhi=2024"
2,"P Symeonidis","Similarity search, recommendation and explainability over graphs in different domains: social media, news, and health industry",2021,"International Conference on Web Engineering","Springer","https://link.springer.com/chapter/10.1007/978-3-030-74296-6_46","https://scholar.google.com/scholar?cites=13035378186281440549&as_sdt=2005&sciodt=2007&hl=en",191,"2025-06-19 13:14:20","","10.1007/978-3-030-74296-6_46","","",,,,,2,0.50,2,1,4,"In this tutorial, we provide a rich blend of theory and practice regarding graph algorithms, to deal with challenging issues such as scalability, data noise, and sparsity in recommender …","","https://scholar.google.com/scholar?q=related:JVUuYmX35rQJ:scholar.google.com/&scioq=source:%22international+conference+on+web+engineering%22&hl=en&as_sdt=2007&as_ylo=2019&as_yhi=2024"
2,"M Noura, Y Wang, S Heil, M Gaedke","OntoSpect: IoT ontology inspection by concept extraction and natural language generation",2021,"International Conference on Web …","Springer","https://link.springer.com/chapter/10.1007/978-3-030-74296-6_4","https://scholar.google.com/scholar?cites=11918914688871073846&as_sdt=2005&sciodt=2007&hl=en",197,"2025-06-19 13:14:20","","10.1007/978-3-030-74296-6_4","","",,,,,2,0.50,1,4,4,"One of the main challenges in the Internet of Things (IoT) is the lack of semantic interoperability between heterogeneous sources. In the Semantic Web domain, ontologies …","https://www.researchgate.net/profile/Mahda-Noura/publication/351483384_OntoSpect_IoT_Ontology_Inspection_by_Concept_Extraction_and_Natural_Language_Generation/links/609e3276a6fdcccacb5219cf/OntoSpect-IoT-Ontology-Inspection-by-Concept-Extraction-and-Natural-Language-Generation.pdf","https://scholar.google.com/scholar?q=related:NohYqsJ9aKUJ:scholar.google.com/&scioq=source:%22international+conference+on+web+engineering%22&hl=en&as_sdt=2007&as_ylo=2019&as_yhi=2024"
2,"R Dedecker, H Delva, P Colpaert…","A file-based linked data fragments approach to prefix search",2021,"International Conference …","Springer","https://link.springer.com/chapter/10.1007/978-3-030-74296-6_5","https://scholar.google.com/scholar?cites=733149814988858304&as_sdt=2005&sciodt=2007&hl=en",204,"2025-06-19 13:14:20","","10.1007/978-3-030-74296-6_5","","",,,,,2,0.50,1,4,4,"Text-fields that need to look up specific entities in a dataset can be equipped with autocompletion functionality. When a dataset becomes too large to be embedded in the …","https://biblio.ugent.be/publication/8709018/file/8709019.pdf","https://scholar.google.com/scholar?q=related:wOONUd-rLAoJ:scholar.google.com/&scioq=source:%22international+conference+on+web+engineering%22&hl=en&as_sdt=2007&as_ylo=2019&as_yhi=2024"
2,"A Langer, C Göpfert, M Gaedke","CARDINAL: Contextualized Adaptive Research Data Description INterface Applying LinkedData",2021,"International Conference on Web …","Springer","https://link.springer.com/chapter/10.1007/978-3-030-74296-6_2","https://scholar.google.com/scholar?cites=6703085934424738489&as_sdt=2005&sciodt=2007&hl=en",205,"2025-06-19 13:14:20","","10.1007/978-3-030-74296-6_2","","",,,,,2,0.50,1,3,4,"In the publishing process for research data, common user interfaces for gathering descriptive structured metadata traditionally rely on static free-text input elements. This …","","https://scholar.google.com/scholar?q=related:ucpNlCQlBl0J:scholar.google.com/&scioq=source:%22international+conference+on+web+engineering%22&hl=en&as_sdt=2007&as_ylo=2019&as_yhi=2024"
1,"A Karakochev, G Zhang","Static analysis of large-scale JavaScript front end",2021,"International Conference on Web Engineering","Springer","https://link.springer.com/chapter/10.1007/978-3-030-74296-6_36","https://scholar.google.com/scholar?cites=17064749727403262444&as_sdt=2005&sciodt=2007&hl=en",210,"2025-06-19 13:14:20","","10.1007/978-3-030-74296-6_36","","",,,,,1,0.25,1,2,4,"In modern web applications, the elaborate GUI of the front end is often developed with large-scale JavaScript frameworks. In such systems, the behavior of one HTML element is usually …","","https://scholar.google.com/scholar?q=related:7MHQ0nYr0uwJ:scholar.google.com/&scioq=source:%22international+conference+on+web+engineering%22&hl=en&as_sdt=2007&as_ylo=2019&as_yhi=2024"
2,"G Panagopoulos, FD Malliaros","Influence Learning and Maximization",2021,"International Conference on Web …","Springer","https://link.springer.com/chapter/10.1007/978-3-030-74296-6_48","https://scholar.google.com/scholar?cites=12511565981794759485&as_sdt=2005&sciodt=2007&hl=en",211,"2025-06-19 13:14:20","","10.1007/978-3-030-74296-6_48","","",,,,,2,0.50,1,2,4,"The problem of maximizing or minimizing the spreading in a social network has become more timely than ever with the advent of fake news and the coronavirus epidemic. The …","https://hal.science/hal-03539200/file/Influence_Learning_Maximization_ICWE_2021.pdf","https://scholar.google.com/scholar?q=related:PfO8qPgCoq0J:scholar.google.com/&scioq=source:%22international+conference+on+web+engineering%22&hl=en&as_sdt=2007&as_ylo=2019&as_yhi=2024"
2,"TW Ha, JM Kang, MH Kim","Real-time deep learning-based anomaly detection approach for multivariate data streams with Apache Flink",2021,"International Conference on Web Engineering","Springer","https://link.springer.com/chapter/10.1007/978-3-030-92231-3_4","https://scholar.google.com/scholar?cites=7476937582565864905&as_sdt=2005&sciodt=2007&hl=en",219,"2025-06-19 13:14:20","","10.1007/978-3-030-92231-3_4","","",,,,,2,0.50,1,3,4,"For detecting anomalies which are unexpected behaviors in complex systems, deep learning-based anomaly detection algorithms for multivariate time series have gained a lot …","","https://scholar.google.com/scholar?q=related:yTWb6B1rw2cJ:scholar.google.com/&scioq=source:%22international+conference+on+web+engineering%22&hl=en&as_sdt=2007&as_ylo=2019&as_yhi=2024"
0,"H Kaindl","High-Level Interaction Design with Discourse Models for Automated Web GUI Generation",2021,"International Conference on Web Engineering","Springer","https://link.springer.com/chapter/10.1007/978-3-030-74296-6_47","",223,"2025-06-19 13:14:20","","10.1007/978-3-030-74296-6_47","","",,,,,0,0.00,0,1,4,"Interaction design is considered important for achieving usable Web user interfaces. Communicative acts as abstractions from speech acts can model basic building blocks …","","https://scholar.google.com/scholar?q=related:sCpRErxh14cJ:scholar.google.com/&scioq=source:%22international+conference+on+web+engineering%22&hl=en&as_sdt=2007&as_ylo=2019&as_yhi=2024"
0,"D Flores-Martin, J Berrocal, J García-Alonso…","SMOTE: A Tool to Proactively Manage Situations in WoT Environments",2021,"International Conference …","Springer","https://link.springer.com/chapter/10.1007/978-3-030-74296-6_44","",229,"2025-06-19 13:14:20","","10.1007/978-3-030-74296-6_44","","",,,,,0,0.00,0,4,4,"The growing number of devices in the Web of Things (WoT) allows larger and more complex smart environments. These environments aim to provide the desired state for the people …","","https://scholar.google.com/scholar?q=related:sxts1WhzehQJ:scholar.google.com/&scioq=source:%22international+conference+on+web+engineering%22&hl=en&as_sdt=2007&as_ylo=2019&as_yhi=2024"
2,"R Rentero-Trejo, D Flores-Martin…","Towards Proactive Context-Aware IoT Environments by Means of Federated Learning",2021,"International Conference …","Springer","https://link.springer.com/chapter/10.1007/978-3-030-92231-3_3","https://scholar.google.com/scholar?cites=7578413762397153346&as_sdt=2005&sciodt=2007&hl=en",231,"2025-06-19 13:14:20","","10.1007/978-3-030-92231-3_3","","",,,,,2,0.50,1,3,4,"Abstract Internet of Things (IoT) integrates billions of smart devices and keeps growing. IoT technologies play a crucial role in smart applications that improve the quality of life …","","https://scholar.google.com/scholar?q=related:QiidLCrvK2kJ:scholar.google.com/&scioq=source:%22international+conference+on+web+engineering%22&hl=en&as_sdt=2007&as_ylo=2019&as_yhi=2024"
0,"D Athanasopoulos, D Keenan","Stability Metrics for Continuous Integration of Service-Oriented Systems",2021,"International Conference on Web …","Springer","https://link.springer.com/chapter/10.1007/978-3-030-74296-6_11","",233,"2025-06-19 13:14:20","","10.1007/978-3-030-74296-6_11","","",,,,,0,0.00,0,2,4,"One of the key principles of the service orientation is the standardised service contract. However, the assumption that the service contract is kept unmodified during the whole life …","","https://scholar.google.com/scholar?q=related:7-dKy32XA3IJ:scholar.google.com/&scioq=source:%22international+conference+on+web+engineering%22&hl=en&as_sdt=2007&as_ylo=2019&as_yhi=2024"
0,"D Rane, V Chourey, I Indraniya","A Novel Approach to Dynamic Pricing for Cloud Computing Through Price Band Prediction",2021,"International Conference on Web …","Springer","https://link.springer.com/chapter/10.1007/978-3-030-92231-3_5","",254,"2025-06-19 13:14:20","","10.1007/978-3-030-92231-3_5","","",,,,,0,0.00,0,3,4,"Cloud computing emerges as a boon to business enterprises that offers increased productivity, economic efficiency and least operational and maintenance costs. The cost for …","","https://scholar.google.com/scholar?q=related:TCDjrQFPCXYJ:scholar.google.com/&scioq=source:%22international+conference+on+web+engineering%22&hl=en&as_sdt=2007&as_ylo=2019&as_yhi=2024"
0,"E Yi, MS Kim","Exploiting Triangle Patterns for Heterogeneous Graph Attention Network",2021,"International Conference on Web Engineering","Springer","https://link.springer.com/chapter/10.1007/978-3-030-92231-3_7","",255,"2025-06-19 13:14:20","","10.1007/978-3-030-92231-3_7","","",,,,,0,0.00,0,2,4,"Recently, graph neural networks (GNNs) have been improved under the influence of various deep learning techniques, such as attention, autoencoders, and recurrent networks …","","https://scholar.google.com/scholar?q=related:spzF2d1aD9YJ:scholar.google.com/&scioq=source:%22international+conference+on+web+engineering%22&hl=en&as_sdt=2007&as_ylo=2019&as_yhi=2024"
0,"D Vu Nguyen Hai, M Gaedke","Applying Predictive Analytics on Research Information to Enhance Funding Discovery and Strengthen Collaboration in Project Proposals",2021,"International Conference on Web …","Springer","https://link.springer.com/chapter/10.1007/978-3-030-74296-6_37","",261,"2025-06-19 13:14:20","","10.1007/978-3-030-74296-6_37","","",,,,,0,0.00,0,2,4,"In academic and industrial research, writing a project proposal is one of the essential but time-consuming activities. Nevertheless, most proposals end in rejection. Moreover …","","https://scholar.google.com/scholar?q=related:SbkLiSqGH2YJ:scholar.google.com/&scioq=source:%22international+conference+on+web+engineering%22&hl=en&as_sdt=2007&as_ylo=2019&as_yhi=2024"
0,"S Yun, D Kim, J Lee","Learning-Based Activation of Energy Harvesting Sensors for Fresh Data Acquisition",2021,"International Conference on Web Engineering","Springer","https://link.springer.com/chapter/10.1007/978-3-030-92231-3_6","",272,"2025-06-19 13:14:20","","10.1007/978-3-030-92231-3_6","","",,,,,0,0.00,0,3,4,"We consider an energy harvesting wireless sensor network (EH-WSN), where each sensor, equipped with the battery, senses its surrounding area. We first define the estimation error of …","","https://scholar.google.com/scholar?q=related:FEexuajtHiAJ:scholar.google.com/&scioq=source:%22international+conference+on+web+engineering%22&hl=en&as_sdt=2007&as_ylo=2019&as_yhi=2024"
0,"M Brambilla, R Chbeir, F Frasincar…","Correction to: Web Engineering",2021,"International Conference …","Springer","https://link.springer.com/content/pdf/10.1007/978-3-030-74296-6_49.pdf","",276,"2025-06-19 13:14:20","","10.1007/978-3-030-74296-6_49","","",,,,,0,0.00,0,4,4,"Correction to: Web Engineering Page 1 Correction to: Web Engineering Marco Brambilla , Richard Chbeir , Flavius Frasincar , and Ioana Manolescu Correction to: M. Brambilla et al. (Eds.) …","","https://scholar.google.com/scholar?q=related:so4-d1StVUkJ:scholar.google.com/&scioq=source:%22international+conference+on+web+engineering%22&hl=en&as_sdt=2007&as_ylo=2019&as_yhi=2024"
5,"L Müller, L Gleim","Managing versioned web resources in the file system",2021,"International Conference on Web Engineering","Springer","https://link.springer.com/chapter/10.1007/978-3-030-74296-6_41","https://scholar.google.com/scholar?cites=14050096385062495078&as_sdt=2005&sciodt=2007&hl=en",277,"2025-06-19 13:14:20","","10.1007/978-3-030-74296-6_41","","",,,,,5,1.25,3,2,4,"While the WebDAV standard provides a well-established read/write mechanism for Web resources, as well as version management through its Delta-V extension, the complexity of …","","https://scholar.google.com/scholar?q=related:ZmOmuzj4-8IJ:scholar.google.com/&scioq=source:%22international+conference+on+web+engineering%22&hl=en&as_sdt=2007&as_ylo=2019&as_yhi=2024"
